{
    "name": "phlix-plugin-example",
    "version": "0.1.0",
    "phlix_min_server_version": "0.10.0",
    "type": "metadata-provider",
    "entry": "Phlix\\PluginExample\\HelloMetadataProvider",
    "events": [],
    "settings": {
        "greeting": {
            "type": "string",
            "required": false,
            "default": "Hello, World"
        }
    },
    "signature": null
}
